{
  "schemaVersion": "1.0",
  "reviewId": "why-ppagent-v0.3.0-visual-review-pre-attempt-06",
  "deckId": "why-ppagent-v0.3.0",
  "stage": "pre-render",
  "attempt": 6,
  "verdict": "pass",
  "issues": [
    {
      "issueId": "VR-PRE-A06-001",
      "severity": "error",
      "category": "hierarchy-error",
      "evidence": "p09 的 PageContent 现有两项短文：mission-01 为“让 AI 读稿，让规则判断，让代码执行。”，conclusion-01 为“能做到，就值得做。”。closing RenderPayload.text 以换行依次保留两句，mappings 又分别把 mission-01 与 conclusion-01 指向 text；使命机制和条件性结论均未遗漏，且没有把“能做到”改成无条件价值断言。",
      "targets": [
        "page-contents[p09]",
        "visual-plan.pages[p09]",
        "render-payloads[p09]"
      ],
      "status": "closed",
      "resolution": "使用两行 closing 文本分别承载使命机制与条件性结论，并为两项内容分别保留映射。",
      "recheckConclusion": "p09 两句短文完整、顺序正确、语义分开，未发现遗漏或语义加强。"
    },
    {
      "issueId": "VR-PRE-A06-002",
      "severity": "warning",
      "category": "relation-error",
      "evidence": "p04 仍使用 role-handoff/alternating-role-relay，前三项为普通角色职责，summary-01 继续以 emphasis=true 和“结论 / 结果”标签进入第四项。当前 role-handoff 运行逻辑会把强调项从角色节点中剥离，单独绘制协同结论，因此没有回归为无标题的第四个角色节点。",
      "targets": [
        "page-intents[p04]",
        "visual-plan.pages[p04]",
        "render-payloads[p04]"
      ],
      "status": "closed",
      "resolution": "保持角色节点与强调结论分离的参数约定和 role-handoff 选择。",
      "recheckConclusion": "p04 的职责接力与总结层级继续正确，上一轮修正保持关闭。"
    },
    {
      "issueId": "VR-PRE-A06-003",
      "severity": "warning",
      "category": "variant-error",
      "evidence": "p03、p08 的 candidate-sets、VisualPlan 与 LayoutDecision 均继续记录 comparison-structure/default/weighted-dual-focus；两页 RenderPayload 都把右侧设为 emphasis=true，左侧为 false，单侧重点与 silhouette 元数据一致。",
      "targets": [
        "candidate-sets[p03]",
        "candidate-sets[p08]",
        "visual-plan.pages[p03]",
        "visual-plan.pages[p08]",
        "layout-decisions[p03]",
        "layout-decisions[p08]",
        "render-payloads[p03]",
        "render-payloads[p08]"
      ],
      "status": "closed",
      "resolution": "继续使用 weighted-dual-focus，并保持右侧 emphasis 参数。",
      "recheckConclusion": "p03、p08 的单侧重点与审计元数据没有回归。"
    },
    {
      "issueId": "VR-PRE-A06-004",
      "severity": "warning",
      "category": "text-fit",
      "evidence": "p02 继续使用 horizontal-cards，前三项为普通步骤，末尾反问以 emphasis=true 和“关键追问”标签呈现，不会重新编号为第四个普通步骤。当前内容长度没有渲染前必然溢出的证据，但 textBudget 仍未由最终画面验证，需在 post-render 检查四列标题、正文和强调标签。",
      "targets": [
        "page-intents[p02].contentStats",
        "visual-plan.pages[p02]",
        "render-payloads[p02]"
      ],
      "status": "open"
    },
    {
      "issueId": "VR-PRE-A06-005",
      "severity": "warning",
      "category": "text-fit",
      "evidence": "p06 的四段因果链语义、familyId、variantId 与 silhouette 均正确，最后一项以“能力结果”标记；但 condition-gap-intervention-result 的四个文字区域仍需容纳最长约 36 字的内容项，真实字体换行和结论节点容量尚无最终画面证据，必须在 post-render 核验。",
      "targets": [
        "page-intents[p06].contentStats",
        "visual-plan.pages[p06]",
        "render-payloads[p06]"
      ],
      "status": "open"
    },
    {
      "issueId": "VR-PRE-A06-006",
      "severity": "warning",
      "category": "text-fit",
      "evidence": "p07 继续使用 staircase，三项内容长度保持压缩后的均衡状态，最终能力项以 emphasis=true 呈现；没有发现渲染前必然超限，但卡片标题区、正文区及强调终点仍需依赖最终画面确认是否完整。",
      "targets": [
        "page-intents[p07].contentStats",
        "visual-plan.pages[p07]",
        "render-payloads[p07]"
      ],
      "status": "open"
    },
    {
      "issueId": "VR-PRE-A06-007",
      "severity": "warning",
      "category": "other",
      "evidence": "九页逐项核对后，所有 VisualPlan 选择都来自对应 candidate-set；LayoutDecision 的 selectedFamilyId、selectedVariantId、selectedSilhouette 与 VisualPlan 完全一致，selectedAssetId 与 RenderPayload.assetId 一致，非 Skin 页面 visualVariantId 与选中 variant 一致。全部 selectionOwner 均为 visual-director、selectionState 均为 selected，visual-resolution 状态为 accepted 且无 feedback。",
      "targets": [
        "visual-plan",
        "layout-decisions",
        "render-payloads",
        "visual-resolution"
      ],
      "status": "closed",
      "resolution": "保持视觉导演在合法候选集上的整套选择，并由确定性解析链复核字段一致性。",
      "recheckConclusion": "未发现非法 family/variant、silhouette 改写、asset 错配或 selectionOwner 回退。"
    }
  ],
  "summary": "第六轮渲染前视觉审查通过。p09 的使命句与条件性结论已完整进入 closing payload，并通过换行和独立来源映射保持语义分开；p04 的角色接力与独立总结、p03/p08 的 weighted-dual-focus、p02 的不编号关键追问、p07 的不编号能力终点均保持关闭状态。九页的候选、VisualPlan、LayoutDecision、RenderPayload 与 visual-resolution 链路一致，所有选择由 visual-director 持有且解析已 accepted。当前无 open error，可以进入渲染；p02、p06、p07 的 text-fit warning 必须在 post-render 使用实际页面证据复核，尤其不能把因果链的文字容量视为已经验证。"
}
